{
  "acceptance_cases": [
    {
      "case_sha256": "810cb80dfda12b1e1b302e37ef634a8dd94b72f8a7f60dbb21392c736fb3ca02",
      "coverage": "PARTIAL",
      "document": "docs/market_demand_os_v7_2/APP-MDOS-REFERENCE-ARCHITECTURE.md",
      "evidence_refs": [
        "EVIDENCE:docs/market_demand_os_v7_2/evidence/baseline-implementation-trace-overlay.v7.1.json",
        "EVIDENCE:reports/market_demand_os_v7/g0-suppression-evidence.json",
        "EVIDENCE:reports/market_demand_os_v7/g1-shadow-evidence.json",
        "EVIDENCE:reports/market_demand_os_v7/g2-outbox-evidence.json"
      ],
      "execution_status": "SPECIFIED_NOT_IMPLEMENTED",
      "expected_result": "Три deliveries, один business effect, полный trace.",
      "id": "AT-ARC-01",
      "line": 200,
      "owner_role": "PlatformOwner",
      "scenario": "Один source event повторно доставлен трижды.",
      "test_bindings": [
        "TEST:tests/test_mdos_v7_projection_outbox.py",
        "TEST:tests/test_mdos_v7_suppression.py"
      ]
    },
    {
      "case_sha256": "a4ddba96b451cd6ab22a01e249486dd1f78aaa5ca6d24ff82bc6a15bdf85a4bb",
      "coverage": "NONE",
      "document": "docs/market_demand_os_v7_2/APP-MDOS-REFERENCE-ARCHITECTURE.md",
      "evidence_refs": [],
      "execution_status": "SPECIFIED_NOT_IMPLEMENTED",
      "expected_result": "Новая claim revision; старый as-of отчёт воспроизводим.",
      "id": "AT-ARC-02",
      "line": 201,
      "owner_role": "PlatformOwner",
      "scenario": "Source исправил дату/участника задним числом.",
      "test_bindings": []
    },
    {
      "case_sha256": "7b94209f78fe9ee5d8bf6c9916872553c5415e9f93e4339dbc0854377950651e",
      "coverage": "NONE",
      "document": "docs/market_demand_os_v7_2/APP-MDOS-REFERENCE-ARCHITECTURE.md",
      "evidence_refs": [],
      "execution_status": "SPECIFIED_NOT_IMPLEMENTED",
      "expected_result": "REVIEW до multi-feature evidence; auto-merge запрещён.",
      "id": "AT-ARC-03",
      "line": 202,
      "owner_role": "PlatformOwner",
      "scenario": "Similar company name и общий телефон.",
      "test_bindings": []
    },
    {
      "case_sha256": "311747eff368bdfe74825a8ca1e962e63cbda3ae31f8c5c418674a2d70180438",
      "coverage": "NONE",
      "document": "docs/market_demand_os_v7_2/APP-MDOS-REFERENCE-ARCHITECTURE.md",
      "evidence_refs": [],
      "execution_status": "SPECIFIED_NOT_IMPLEMENTED",
      "expected_result": "Source records, DemandUnit и attribution пересчитаны с lineage.",
      "id": "AT-ARC-04",
      "line": 203,
      "owner_role": "PlatformOwner",
      "scenario": "Ошибочный merge разделён.",
      "test_bindings": []
    },
    {
      "case_sha256": "e3237a463b9299cebae0b1d083657e0c13358d9e5c48d24173e05c9aea0f2969",
      "coverage": "NONE",
      "document": "docs/market_demand_os_v7_2/APP-MDOS-REFERENCE-ARCHITECTURE.md",
      "evidence_refs": [],
      "execution_status": "SPECIFIED_NOT_IMPLEMENTED",
      "expected_result": "Новый claim set; raw hash неизменен; оба producer versions видимы.",
      "id": "AT-ARC-05",
      "line": 204,
      "owner_role": "PlatformOwner",
      "scenario": "Raw page переобработана новой моделью.",
      "test_bindings": []
    },
    {
      "case_sha256": "5adccf92b09faed24a9dbb34808baf30a2ed0c6a174dae766c56a6473019a0fe",
      "coverage": "PARTIAL",
      "document": "docs/market_demand_os_v7_2/APP-MDOS-REFERENCE-ARCHITECTURE.md",
      "evidence_refs": [
        "EVIDENCE:docs/market_demand_os_v7_2/evidence/baseline-implementation-trace-overlay.v7.1.json",
        "EVIDENCE:reports/market_demand_os_v7/g1-shadow-evidence.json",
        "EVIDENCE:reports/market_demand_os_v7/g1-split-payment-shadow-evidence.json"
      ],
      "execution_status": "SPECIFIED_NOT_IMPLEMENTED",
      "expected_result": "Payment conflict/quarantine; KPI не растёт.",
      "id": "AT-ARC-06",
      "line": 205,
      "owner_role": "PlatformOwner",
      "scenario": "CRM показывает PAID, а банковского/платёжного proof нет.",
      "test_bindings": [
        "TEST:tests/test_mdos_v7_adversarial.py",
        "TEST:tests/test_mdos_v7_bitrix_crm_claims.py",
        "TEST:tests/test_mdos_v7_g1.py",
        "TEST:tests/test_mdos_v7_split_payments.py"
      ]
    },
    {
      "case_sha256": "67a6c5464ad3f6d0bbcf4d670f266d6bccc79045365b502987e83e9c37ed33ea",
      "coverage": "PARTIAL",
      "document": "docs/market_demand_os_v7_2/APP-MDOS-REFERENCE-ARCHITECTURE.md",
      "evidence_refs": [
        "EVIDENCE:docs/market_demand_os_v7_2/evidence/baseline-implementation-trace-overlay.v7.1.json",
        "EVIDENCE:reports/market_demand_os_v7/g1-shadow-evidence.json",
        "EVIDENCE:reports/market_demand_os_v7/g2-outbox-evidence.json"
      ],
      "execution_status": "SPECIFIED_NOT_IMPLEMENTED",
      "expected_result": "Activity + новый distinct Deal; duplicate Company/Lead не создаётся.",
      "id": "AT-ARC-07",
      "line": 206,
      "owner_role": "PlatformOwner",
      "scenario": "Accepted existing account прислал второй RFQ.",
      "test_bindings": [
        "TEST:tests/test_mdos_v7_projection_outbox.py"
      ]
    },
    {
      "case_sha256": "09cbefd6c438ef4c76598637ca76996e377797ee6d3dbdbb3b17dffec8638f4b",
      "coverage": "NONE",
      "document": "docs/market_demand_os_v7_2/APP-MDOS-REFERENCE-ARCHITECTURE.md",
      "evidence_refs": [],
      "execution_status": "SPECIFIED_NOT_IMPLEMENTED",
      "expected_result": "Promise/GDO/action blocked; research допускается.",
      "id": "AT-ARC-08",
      "line": 207,
      "owner_role": "PlatformOwner",
      "scenario": "Capacity snapshot просрочен.",
      "test_bindings": []
    },
    {
      "case_sha256": "f5ebc1ca04b4a3a96fc95e84c17864b7c44948a282ce0d45f64138fc94e368c8",
      "coverage": "PARTIAL",
      "document": "docs/market_demand_os_v7_2/APP-MDOS-REFERENCE-ARCHITECTURE.md",
      "evidence_refs": [
        "EVIDENCE:docs/market_demand_os_v7_2/evidence/baseline-implementation-trace-overlay.v7.1.json",
        "EVIDENCE:reports/market_demand_os_v7/g0-suppression-evidence.json"
      ],
      "execution_status": "SPECIFIED_NOT_IMPLEMENTED",
      "expected_result": "Deterministic/manual path; raw/event/legal ledgers сохранены.",
      "id": "AT-ARC-09",
      "line": 208,
      "owner_role": "PlatformOwner",
      "scenario": "AI provider недоступен.",
      "test_bindings": [
        "TEST:tests/test_mdos_v7_suppression.py"
      ]
    },
    {
      "case_sha256": "d8bc73c4772ff85474ba058843f9bea5977f64835891c8f4dded4ea44781365a",
      "coverage": "NONE",
      "document": "docs/market_demand_os_v7_2/APP-MDOS-REFERENCE-ARCHITECTURE.md",
      "evidence_refs": [],
      "execution_status": "SPECIFIED_NOT_IMPLEMENTED",
      "expected_result": "Incident + automatic pause/rollback.",
      "id": "AT-ARC-10",
      "line": 209,
      "owner_role": "PlatformOwner",
      "scenario": "Deployed policy digest отличается от release.",
      "test_bindings": []
    },
    {
      "case_sha256": "2b444ab4967eba91946ca60c878a18951b12411446176e023ef451fc1245e0f0",
      "coverage": "PARTIAL",
      "document": "docs/market_demand_os_v7_2/APP-MDOS-REFERENCE-ARCHITECTURE.md",
      "evidence_refs": [
        "EVIDENCE:docs/market_demand_os_v7_2/evidence/baseline-implementation-trace-overlay.v7.1.json",
        "EVIDENCE:reports/market_demand_os_v7/g1-shadow-evidence.json",
        "EVIDENCE:reports/market_demand_os_v7/g1-split-payment-shadow-evidence.json"
      ],
      "execution_status": "SPECIFIED_NOT_IMPLEMENTED",
      "expected_result": "Outcome schema reject; только claim/conflict.",
      "id": "AT-ARC-11",
      "line": 210,
      "owner_role": "PlatformOwner",
      "scenario": "Contract/invoice/акт указан как authoritative payment.",
      "test_bindings": [
        "TEST:tests/test_mdos_v7_adversarial.py",
        "TEST:tests/test_mdos_v7_bitrix_crm_claims.py",
        "TEST:tests/test_mdos_v7_g1.py",
        "TEST:tests/test_mdos_v7_split_payments.py"
      ]
    },
    {
      "case_sha256": "b53a5ca934985e66951439413afdb53f0e765f8d6fd9b55cc6560d4ed6d01ed5",
      "coverage": "NONE",
      "document": "docs/market_demand_os_v7_2/APP-MDOS-REFERENCE-ARCHITECTURE.md",
      "evidence_refs": [],
      "execution_status": "SPECIFIED_NOT_IMPLEMENTED",
      "expected_result": "Reconciliation conflict; KPI блокируется.",
      "id": "AT-ARC-12",
      "line": 211,
      "owner_role": "PlatformOwner",
      "scenario": "Valid PaymentProof связан с неизвестным OrderRecord.",
      "test_bindings": []
    },
    {
      "case_sha256": "dab75a95313f3e92e49a6342c8614436bebbab3d27c95aea5ba192048f777916",
      "coverage": "PARTIAL",
      "document": "docs/market_demand_os_v7_2/APP-MDOS-REFERENCE-ARCHITECTURE.md",
      "evidence_refs": [
        "EVIDENCE:docs/market_demand_os_v7_2/evidence/baseline-implementation-trace-overlay.v7.1.json",
        "EVIDENCE:reports/market_demand_os_v7/g1-shadow-evidence.json",
        "EVIDENCE:reports/market_demand_os_v7/g1-split-payment-shadow-evidence.json",
        "EVIDENCE:reports/market_demand_os_v7/g2-outbox-evidence.json"
      ],
      "execution_status": "SPECIFIED_NOT_IMPLEMENTED",
      "expected_result": "Projection обновляется; canonical PaymentProof неизменен.",
      "id": "AT-ARC-13",
      "line": 212,
      "owner_role": "PlatformOwner",
      "scenario": "Bitrix Deal изменён после банковской оплаты.",
      "test_bindings": [
        "TEST:tests/test_mdos_v7_adversarial.py",
        "TEST:tests/test_mdos_v7_bitrix_crm_claims.py",
        "TEST:tests/test_mdos_v7_g1.py",
        "TEST:tests/test_mdos_v7_projection_outbox.py",
        "TEST:tests/test_mdos_v7_split_payments.py"
      ]
    },
    {
      "case_sha256": "9bbb0950e461f9fa0c41739c7b9a8966ac1b6ffa26036aa1a194610aeea084fb",
      "coverage": "NONE",
      "document": "docs/market_demand_os_v7_2/APP-MDOS-REFERENCE-ARCHITECTURE.md",
      "evidence_refs": [],
      "execution_status": "SPECIFIED_NOT_IMPLEMENTED",